{
  "$schema": "./evals.schema.json",
  "suiteVersion": "0.1.1",
  "status": "not-run",
  "notes": "This suite has never been executed. It defines how a baseline-versus-pack comparison would be run; it contains no results and no claims. Every case is written so that a wrong answer is visibly wrong, not so that the pack looks good. Prompts are original text written for this repository; no vendor documentation prose is reproduced anywhere in this suite or its fixtures. The skill slugs below were read from .agents/skills/ on 2026-08-26; evals/run.mjs re-reads them at prepare time and warns if they have moved.",
  "packUnderTest": {
    "version": "0.3.0-pre.1",
    "skillsAuthored": 9,
    "caveat": "The nine skills exist and are mapped to cases below, but no case has ever been run, so this repository holds no evidence that any of them helps, is neutral, or hurts. The mapping in relevantSkills is a statement of intent about which skill should fire, not an observation that it does; whether a skill actually activates is measured per run from the transcript, and the non-trigger case exists precisely to catch a pack that fires when it should not."
  },
  "armDefinitions": {
    "with_pack": "Workspace = the case fixture plus the pack context files copied from the repository root (AGENTS.md, CLAUDE.md, GEMINI.md, .github/copilot-instructions.md, .github/instructions/, .agents/skills/, .github/skills/, .claude/skills/, .claude/rules/, manifest.json, VERSION). Every copied file is hashed into PACK-STATE.json so the arm is reproducible.",
    "without_pack": "Workspace = the case fixture only, byte-identical to the with_pack fixture bytes, with no pack context file present anywhere in the workspace. Identical prompt, identical tool, identical model, identical clean-context protocol."
  },
  "tools": [
    {
      "id": "github-copilot",
      "displayName": "GitHub Copilot (agent mode)",
      "invocation": "manual-only",
      "transcriptCapture": "Operator copies the full session transcript by hand into transcript.md, including every tool call the UI displays. If the tool offers a session export, use it and record the export path in evidence.extraPaths.",
      "tokenReporting": "unverified",
      "toolCallReporting": "unverified",
      "notes": "Token and tool-call visibility have not been confirmed for this tool by this repository. The operator records what is actually observable, and 'unavailable' is an acceptable and expected answer that simply disqualifies the run from the token gate."
    },
    {
      "id": "github-copilot-cli",
      "displayName": "GitHub Copilot CLI",
      "invocation": "manual-only",
      "transcriptCapture": "Run each arm in a fresh noninteractive prompt process and preserve the CLI session share plus JSONL events. Record the exact CLI/model/effort flags and copy the final response and tool-call evidence into transcript.md.",
      "tokenReporting": "tool-reported",
      "toolCallReporting": "tool-reported",
      "notes": "Verified in a non-claim pilot on 2026-08-26 with Copilot CLI 1.0.80: session.shutdown events expose exact input/output/cache tokens, AI credits and tool calls. The pilot was invalid for comparison because its eval pack version was stale; it is evidence about reporting capability only."
    },
    {
      "id": "claude-code",
      "displayName": "Claude Code",
      "invocation": "manual-only",
      "transcriptCapture": "Operator captures the full terminal session (for example via script/tee or a terminal buffer export) into transcript.md, including tool invocations.",
      "tokenReporting": "unverified",
      "toolCallReporting": "unverified",
      "notes": "Same rule: record only what the tool actually reports at run time. Do not infer token counts from pricing, timing, or output length."
    }
  ],
  "skillRegistry": {
    "status": "authored",
    "note": "These slugs were read from .agents/skills/ on 2026-08-26, where each has a SKILL.md. A case's relevantSkills entry says which skill the case is intended to exercise; it is not evidence that the skill fired, helped, or was even loaded. run.mjs --prepare re-reads .agents/skills/ and reports the true authored count and slug list into PACK-STATE.json for every with_pack run, so a result can always be traced back to the exact skill content that was present.",
    "slugs": [
      { "slug": "react-vite-feature-slice", "provisionalTopic": "Client-side feature work in the React and Vite web app", "authored": true },
      { "slug": "aspnetcore-endpoint-slice", "provisionalTopic": "Adding or changing an HTTP endpoint and its contract in the API", "authored": true },
      { "slug": "efcore-azuresql-change", "provisionalTopic": "Model, migration and query changes against the SQL database", "authored": true },
      { "slug": "entra-managed-identity-wiring", "provisionalTopic": "Identity-based, secretless access to cloud resources and the role assignments it needs", "authored": true },
      { "slug": "appinsights-telemetry-and-triage", "provisionalTopic": "Instrumentation, correlation and evidence-led incident triage", "authored": true },
      { "slug": "bicep-infra-change", "provisionalTopic": "Declarative infrastructure changes and their preview and deployment", "authored": true },
      { "slug": "azure-appservice-deploy", "provisionalTopic": "Hosting configuration and deployment of the web and API tiers", "authored": true },
      { "slug": "release-staging-to-production", "provisionalTopic": "Promotion through environments, gates, migration ordering and rollback", "authored": true },
      { "slug": "secure-by-design-review", "provisionalTopic": "Structured, evidence-based security review across the stack", "authored": true }
    ]
  },
  "cases": [
    {
      "id": "vertical-slice-react-api-ef",
      "title": "Implement one feature end to end across React, the API and EF Core",
      "category": "implementation",
      "riskLevel": "medium",
      "risk": "A partial vertical slice ships a button that calls an endpoint that does not persist, or persistence that no caller reaches. The defect is invisible in review and surfaces as silent data loss for users who believe the action worked.",
      "prompt": "In this workspace, implement an 'archive work order' feature end to end. The list at web/src/features/workorders/WorkOrderList.tsx needs a per-row archive action that calls a new API endpoint; the API in api/ needs that endpoint; and the archive must be persisted through EF Core so an archived work order stays archived after a restart. Follow the layout and conventions already present in the workspace. Do not add any npm or NuGet dependencies.",
      "promptNotes": "Do not tell the agent which files to change beyond the entry point named above, and do not mention migrations - whether it reaches for one is part of what is being measured.",
      "fixtures": [{ "source": "fixtures/vertical-slice", "mountAt": "." }],
      "expectedArtifacts": [
        { "path": "api/Endpoints/WorkOrdersEndpoints.cs", "kind": "modified", "required": true, "description": "The archive endpoint, mapped alongside the existing GET." },
        { "path": "web/src/features/workorders/WorkOrderList.tsx", "kind": "modified", "required": true, "description": "The archive action wired to the new endpoint." },
        { "path": "api/Models/WorkOrder.cs", "kind": "modified", "required": true, "description": "Whatever state the archive is recorded in." },
        { "path": "web/package.json", "kind": "unchanged", "required": false, "description": "Must not gain dependencies." },
        { "path": "api/Api.csproj", "kind": "unchanged", "required": false, "description": "Must not gain dependencies." }
      ],
      "assertions": [
        { "id": "endpoint-file-present", "type": "file-exists", "severity": "blocking", "target": "workspace", "path": "api/Endpoints/WorkOrdersEndpoints.cs", "description": "The endpoints file still exists after the change." },
        { "id": "endpoint-write-verb", "type": "file-matches", "severity": "blocking", "target": "workspace", "path": "api/Endpoints/WorkOrdersEndpoints.cs", "pattern": "Map(Post|Put|Patch|Delete)\\s*\\(", "description": "A write-shaped endpoint was added; a GET alone cannot archive anything.", "rationale": "Checks shape, not correctness. A mapped write verb is necessary but not sufficient." },
        { "id": "endpoint-mentions-archive", "type": "file-matches", "severity": "blocking", "target": "workspace", "path": "api/Endpoints/WorkOrdersEndpoints.cs", "pattern": "archive", "flags": "i", "description": "The new endpoint is actually about archiving." },
        { "id": "client-calls-api", "type": "file-matches", "severity": "blocking", "target": "workspace", "path": "web/src/features/workorders/WorkOrderList.tsx", "pattern": "(sendJson|postJson|fetch\\s*\\(|apiClient)", "description": "The React component issues a request rather than only mutating local state.", "rationale": "A component that flips a local flag without calling the API is the exact failure this case exists to catch." },
        { "id": "client-mentions-archive", "type": "file-matches", "severity": "blocking", "target": "workspace", "path": "web/src/features/workorders/WorkOrderList.tsx", "pattern": "archive", "flags": "i", "description": "The client change is the archive action, not something else." },
        { "id": "persistence-state-added", "type": "any-file-matches", "severity": "blocking", "target": "workspace", "pathGlob": "api/**/*.cs", "pattern": "(IsArchived|ArchivedAt|ArchivedOn|ArchivedUtc)", "description": "Archive state exists in the server-side model or configuration." },
        { "id": "no-new-npm-dependencies", "type": "file-unchanged", "severity": "blocking", "target": "workspace", "path": "web/package.json", "description": "web/package.json is byte-identical to the prepared fixture." },